{
  "$schema": "https://json-schema.org/draft/2020-12/schema",
  "$id": "https://timaday.github.io/codex-governed-change/schemas/reviewer-qualification-label-decision.schema.json",
  "title": "Authenticated human approval of reviewer qualification labels",
  "type": "object",
  "additionalProperties": false,
  "required": ["schema_version", "decision_id", "repository_id", "decision_type", "approved_corpus_id", "approved_case_ids", "approved_labels", "approved_modes", "issuer", "issued_at", "expires_at"],
  "properties": {
    "schema_version": {"const": "1.0.0"},
    "decision_id": {"type": "string", "pattern": "^sha256:[0-9a-f]{64}$"},
    "repository_id": {"type": "string", "pattern": "^repo:[a-z0-9][a-z0-9._/-]{2,255}$"},
    "decision_type": {"const": "reviewer_qualification_labels"},
    "approved_corpus_id": {"type": "string", "pattern": "^sha256:[0-9a-f]{64}$"},
    "approved_case_ids": {"type": "array", "minItems": 2, "uniqueItems": true, "items": {"type": "string", "minLength": 1}},
    "approved_labels": {"type": "object"},
    "approved_modes": {"type": "array", "minItems": 2, "uniqueItems": true, "items": {"enum": ["conformance", "rapid_review"]}},
    "issuer": {
      "type": "object",
      "additionalProperties": false,
      "required": ["subject", "authentication_method", "protected_source", "assertion_sha256"],
      "properties": {
        "subject": {"type": "string", "minLength": 1},
        "authentication_method": {"type": "string", "minLength": 1},
        "protected_source": {"type": "string", "minLength": 1},
        "assertion_sha256": {"type": "string", "pattern": "^sha256:[0-9a-f]{64}$"}
      }
    },
    "issued_at": {"$ref": "#/$defs/timestamp"},
    "expires_at": {"$ref": "#/$defs/timestamp"}
  },
  "$defs": {
    "timestamp": {"type": "string", "pattern": "^[0-9]{4}-(0[1-9]|1[0-2])-([0-2][0-9]|3[01])T([01][0-9]|2[0-3]):[0-5][0-9]:([0-5][0-9]|60)(\\.[0-9]+)?(Z|[+-]([01][0-9]|2[0-3]):[0-5][0-9])$"}
  }
}
