{
  "schema_version": "1.0.0",
  "decision_id": "sha256:e9fb454179f14b69b28937146ab1f589ce512df379c56a30ac5a4346494c85c5",
  "repository_id": "repo:example/codex-governed-change",
  "decision_type": "reviewer_qualification_labels",
  "approved_corpus_id": "sha256:a42f677e82d0c3ad01c9bcc6917edb82f1ad807e0834c15601358ab48d5012a7",
  "approved_case_ids": ["QUAL-CRITICAL-001", "QUAL-CONTROL-002"],
  "approved_labels": {"QUAL-CRITICAL-001": "BLOCK", "QUAL-CONTROL-002": "NO_BLOCKING_FINDING_OBSERVED"},
  "approved_modes": ["conformance", "rapid_review"],
  "issuer": {
    "subject": "github:example-reviewer",
    "authentication_method": "github-actions-workflow-dispatch",
    "protected_source": "example/codex-governed-change-authority@refs/heads/main",
    "assertion_sha256": "sha256:ecda3b0e1a2c5a31905c870d3fedcdcd0076fa4066085278d36bf7ac4fbd3872"
  },
  "issued_at": "2026-08-26T10:00:00Z",
  "expires_at": "2027-08-26T10:00:00Z"
}
